{
  "schema_version": "TaskResourceLedgerV1",
  "ledger_id": "narratwin-issue524-resource-ledger-20260909-v1",
  "session_id": "narratwin-issue524-convergence-20260909",
  "mode": "package",
  "ledger_state": "frozen",
  "created_at": "2026-09-09T11:26:40Z",
  "snapshot_at": "2026-09-09T11:26:40Z",
  "owner": "narratwin-primary-orchestrator",
  "review_state": "reviewed",
  "authority_ref": "github-issue:524#issuecomment-5601014173",
  "expires_at": "2026-09-16T11:26:40Z",
  "explicit_exclusions": ["Unrelated dirty primary checkout and its uncommitted state.","Historical worktrees, local branches, and remote branches not created by Issue #524.","Shared package, browser, and operating-system caches.","Docker resources not created by Issue #524.","Private evidence, provider media, biometrics, credentials, and secret-bearing files.","Task-unrelated temporary, scratchpad, editor, and IPC resources."],
  "contexts": [
    {"context_id":"issue524-repository-context","public_ref":"repo:narratwin-ai/issue-524/worktree-context","kind":"repository","restricted_storage_state":"unknown","policy_refs":["github-issue:524#issuecomment-5601014173","stackclimb:TaskResourceLedgerV1@1.0.0","repo:AGENTS.md#merge-closeout"],"exclusions":["unrelated dirty primary checkout","historical worktrees and branches","shared caches","private evidence and credentials"]},
    {"context_id":"issue524-task-temp-context","public_ref":"local-temp:narratwin/issue-524/task-cache-context","kind":"workspace","restricted_storage_state":"unknown","policy_refs":["github-issue:524#issuecomment-5601014173","stackclimb:TaskResourceLedgerV1@1.0.0","repo:AGENTS.md#merge-closeout"],"exclusions":["task-unrelated temporary resources","global package and browser stores","private evidence and credentials"]}
  ],
  "inventory_probes": [
    {"probe_id":"issue524-git-state-probe","context_ref":"issue524-repository-context","resource_kind":"local branch and worktree","status":"completed","item_count":2,"snapshot_at":"2026-09-09T11:26:40Z","coverage_gap":null,"evidence_refs":["restricted-probe:issue524/git-state-and-worktree-list"]},
    {"probe_id":"issue524-generated-resource-probe","context_ref":"issue524-repository-context","resource_kind":"task-created worktree resource","status":"completed","item_count":12,"snapshot_at":"2026-09-09T11:26:40Z","coverage_gap":null,"evidence_refs":["restricted-probe:issue524/no-follow-worktree-manifests"]},
    {"probe_id":"issue524-temporary-cache-probe","context_ref":"issue524-task-temp-context","resource_kind":"exact task temporary cache","status":"completed","item_count":2,"snapshot_at":"2026-09-09T11:26:40Z","coverage_gap":null,"evidence_refs":["restricted-probe:issue524/no-follow-temporary-cache-manifests"]},
    {"probe_id":"issue524-remote-branch-probe","context_ref":"issue524-repository-context","resource_kind":"remote branch","status":"completed","item_count":0,"snapshot_at":"2026-09-09T11:26:40Z","coverage_gap":null,"evidence_refs":["restricted-probe:issue524/exact-remote-ref-query"]},
    {"probe_id":"issue524-process-port-probe","context_ref":"issue524-repository-context","resource_kind":"process and port","status":"partial","item_count":0,"snapshot_at":"2026-09-09T11:26:40Z","coverage_gap":"No pre-creation process registry exists; the current exact-worktree open-file scan found no persistent task process.","evidence_refs":["restricted-probe:issue524/current-process-and-port-scan"]},
    {"probe_id":"issue524-docker-probe","context_ref":"issue524-repository-context","resource_kind":"Docker container image volume network builder and cache","status":"partial","item_count":0,"snapshot_at":"2026-09-09T11:26:40Z","coverage_gap":"Exact Issue #524 name and label scans found no task-owned Docker object; unrelated engine objects are excluded.","evidence_refs":["restricted-probe:issue524/docker-name-and-label-scan"]}
  ],
  "resources": [
    {"resource_id":"issue524-branch","context_ref":"issue524-repository-context","public_ref":"repo:narratwin-ai/issue-524/local-branch","kind":"local-branch","identity_fingerprint":"git-commit:f078614e19e935c939ea2bacc70592062dc34688","existed_before_task":false,"ownership":"exclusive","activity":"active","reference_state":"referenced","sensitivity":"ordinary","recoverability":"unknown","retention_class":"success-clean","retention_trigger_state":"pending","evidence_obligation":"active","legal_hold":"none","cleanup_contract":{"disposition":"delete","kind":"local-branch","locator":"repo:narratwin-ai/issue-524/local-branch","trigger":"accepted combined merge, merged-main hosted verification, and remote synchronization completed"},"kind_evidence":{"evidence_refs":["restricted-snapshot:issue524-branch/kind"],"branch_recoverable":false},"logical_bytes":null,"exclusive_reclaimable_bytes":null,"measurement_confidence":"unknown","eligibility_evidence_refs":["restricted-snapshot:issue524-branch/eligibility-pending"],"evidence_refs":["restricted-snapshot:issue524-branch/inventory","restricted-snapshot:issue524-branch/head-and-ref-snapshot"],"dependency_resource_ids":["issue524-worktree"],"lifecycle_state":"classified","decision_reasons":["Issue #524 branch was checked out by the active dedicated worktree at the snapshot.","It was not yet merged, synchronized, or eligible for deletion."],"authorization_ref":null,"verification":{"result":"not-run","evidence_refs":[]}},
    {"resource_id":"issue524-worktree","context_ref":"issue524-repository-context","public_ref":"repo:narratwin-ai/issue-524/worktree","kind":"worktree","identity_fingerprint":"sha256:3822089a8c4d712a9dea7fff0bf3b40964f2cb7a31f9205ea4fa4ae21afe1bdd","existed_before_task":false,"ownership":"exclusive","activity":"active","reference_state":"referenced","sensitivity":"ordinary","recoverability":"recoverable","retention_class":"success-clean","retention_trigger_state":"pending","evidence_obligation":"active","legal_hold":"none","cleanup_contract":{"disposition":"delete","kind":"worktree","locator":"repo:narratwin-ai/issue-524/worktree","trigger":"accepted combined merge and merged-main hosted verification completed, with contained task resources verified absent"},"kind_evidence":{"evidence_refs":["restricted-snapshot:issue524-worktree/kind"],"worktree_clean":true},"logical_bytes":null,"exclusive_reclaimable_bytes":null,"measurement_confidence":"unknown","eligibility_evidence_refs":["restricted-snapshot:issue524-worktree/eligibility-pending"],"evidence_refs":["restricted-snapshot:issue524-worktree/inventory","restricted-snapshot:issue524-worktree/clean-head-tree-device-inode-snapshot"],"dependency_resource_ids":["issue524-venv","issue524-node-modules","issue524-next-output","issue524-tsbuildinfo","issue524-next-env","issue524-mypy-cache","issue524-pytest-cache","issue524-ruff-cache","issue524-scripts-pycache","issue524-scripts-ci-pycache","issue524-scripts-quality-pycache","issue524-tests-unit-pycache"],"lifecycle_state":"classified","decision_reasons":["Dedicated worktree was clean at the recorded head and remained an active verification context.","Removal requires clean-state and contained-resource revalidation after accepted merge."],"authorization_ref":null,"verification":{"result":"not-run","evidence_refs":[]}},
    {"resource_id":"issue524-venv","context_ref":"issue524-repository-context","public_ref":"repo:narratwin-ai/issue-524/worktree/.venv","kind":"virtual-environment","identity_fingerprint":"sha256:2a8814c753c2e0fc027119ade0e37cdd47f96c40e9e50bf5110275620df18a8c","existed_before_task":false,"ownership":"exclusive","activity":"inactive","reference_state":"referenced","sensitivity":"ordinary","recoverability":"recreatable","retention_class":"success-clean","retention_trigger_state":"pending","evidence_obligation":"active","legal_hold":"none","cleanup_contract":{"disposition":"delete","kind":"virtual-environment","locator":"repo:narratwin-ai/issue-524/worktree/.venv","trigger":"accepted combined merge and merged-main hosted verification completed"},"kind_evidence":{"evidence_refs":["restricted-snapshot:issue524-venv/kind"],"leaf_shape":"directory-tree","hard_link_coverage_complete":true},"logical_bytes":351828409,"exclusive_reclaimable_bytes":351828409,"measurement_confidence":"exact","eligibility_evidence_refs":["restricted-snapshot:issue524-venv/eligibility-pending"],"evidence_refs":["restricted-snapshot:issue524-venv/inventory","restricted-snapshot:issue524-venv/complete;entries=12310;files=11002;directories=1305;symlinks=3;hardlinked-files=0;mount-crossings=0;errors=0"],"dependency_resource_ids":[],"lifecycle_state":"classified","decision_reasons":["Task-created exact resource is retained while verification and evidence obligations remain active.","Cleanup requires a later exact proposal, current-session authority, and fresh survivor-safe revalidation."],"authorization_ref":null,"verification":{"result":"not-run","evidence_refs":[]}},